sku,nombre,descripcion,categoria,ubicacion,stock,stock_minimo,precio
,Taladro percutor Bosch GSB 750W,Taladro percutor profesional 750W con maletín,Herramientas eléctricas,A-12-3,15,5,89.90
,Caja de tornillos M6 x 200ud,Caja de 200 tornillos de acero inoxidable M6,Tornillería,B-04-1,40,10,12.50
,Casco de seguridad amarillo,Casco EN 397 con ajuste por rueda y barboquejo,EPI,C-01-2,25,8,14.99
,Llave inglesa 12",Llave ajustable 12 pulgadas acero cromo-vanadio,Herramientas manuales,A-08-4,18,5,9.95
SKU-FIJO-01,Cinta métrica 5m,Cinta métrica con freno y clip de cinturón,Herramientas manuales,A-08-5,30,10,7.50
